{
  "rule_files": "templates/claude-rules/",
  "version": "V2",
  "normative_headings": [
    "Core Principles", "Non-Negotiable Rules", "Code Organization", "Naming Standards",
    "Design For Debugging", "Error Handling", "Testing Standards", "Observability Standards",
    "Performance Standards", "Security Standards", "Dependency Standards", "Documentation Standards",
    "Review And Change Standards", "Refactoring Standards", "Debugging Protocol", "Anti-Slop Checklist",
    "Rust", "Python", "TypeScript And JavaScript", "React", "Go", "Java", "Kotlin", "C#",
    "C And C++", "SQL", "Shell", "HTML, CSS, And UI Styling", "Infrastructure As Code",
    "YAML, JSON, And Config", "AI-Assisted Coding Standards", "Master Techniques For Maintainable Systems",
    "Quality Gates"
  ],
  "sections": [
    {"id":"core-principles","heading":"Core Principles","scope":"all_normative_items","status":"partial","mechanism":"instruction","supported_languages":["all"],"enforcement_stages":["packet"],"limitations":"Principles are contextual guidance, not static semantic proof.","notes":"Principles enter relevant packets; correctness is not claimed as static proof."},
    {"id":"non-negotiable-rules","heading":"Non-Negotiable Rules","scope":"all_normative_items","status":"partial","mechanism":"native","rule_ids":["no-committed-secrets","no-swallowed-errors","external-call-timeout","public-input-validation","sql-parameterization","bounded-retries-loops","destructive-operation-safeguards"],"supported_languages":["all"],"enforcement_stages":["pre_tool","post_tool","stop"],"limitations":"Only listed rules have deterministic checks; remaining bullets require review.","notes":"Listed rules have checks; remaining bullets remain review or unsupported until mapped."},
    {"id":"code-organization","heading":"Code Organization","scope":"all_normative_items","status":"partial","mechanism":"native","rule_ids":["function-size","file-size","function-complexity","module-boundary-review"],"supported_languages":["all"],"enforcement_stages":["packet","post_tool","stop"],"limitations":"Lexical spans and metrics are bounded; architectural layering and unsupported language imports remain review-tier.","notes":"Bounded substrate reports oversized functions/files, type spans, complexity, and deterministic relative import cycles."},
    {"id":"naming-standards","heading":"Naming Standards","scope":"all_normative_items","status":"partial","mechanism":"native","rule_ids":["naming-review"],"supported_languages":["python","rust","typescript","javascript","go"],"enforcement_stages":["packet","post_tool","stop"],"limitations":"Only clearly placeholder function names are flagged; language-specific style and protocol fields remain review.","notes":"Conservative native review flags obvious placeholder function identifiers without claiming universal naming proof."},
    {"id":"design-for-debugging","heading":"Design For Debugging","scope":"all_normative_items","status":"partial","mechanism":"review","supported_languages":["all"],"enforcement_stages":["packet","stop"],"limitations":"Observability semantics remain review guidance.","notes":"Failure context and deterministic repro guidance are selected by intent; observability semantics remain review."},
    {"id":"error-handling","heading":"Error Handling","scope":"all_normative_items","status":"partial","mechanism":"native","rule_ids":["no-swallowed-errors","no-broad-exception-handling","boundary-error-review","error-contract-review"],"supported_languages":["all","python","typescript","javascript"],"enforcement_stages":["post_tool","stop"],"limitations":"Wrappers cover selected Python patterns; boundary conversion, cleanup, and retry semantics remain review.","notes":"Python wrappers, empty-handler review, and lexical boundary-contract review are active; cross-language conversion and retry semantics remain planned."},
    {"id":"testing-standards","heading":"Testing Standards","scope":"all_normative_items","status":"partial","mechanism":"evidence","rule_ids":["regression-test-required","new-behavior-tests-required","required-repository-commands","evidence-claims-honest","test-quality-guidance","behavior-test-quality","determinism-review","test-naming-review"],"supported_languages":["all"],"enforcement_stages":["prompt","post_tool","stop","report"],"limitations":"Coverage metrics and nuanced assertion-strength proof remain planned; high-confidence test-quality, naming, and determinism signals are review findings.","notes":"Diff and command evidence cover required behavior; contextual signals request appropriate test types, flag trivial assertions, identify likely nondeterminism, and flag generic test symbols."},
    {"id":"observability-standards","heading":"Observability Standards","scope":"all_normative_items","status":"partial","mechanism":"review","rule_ids":["structured-observability-review","sensitive-logging-review"],"supported_languages":["all"],"enforcement_stages":["prompt","post_tool","stop"],"limitations":"No universal log, metric, or trace proof is implemented.","notes":"Long-running service and worker signals activate observability guidance; sensitive logging gets bounded lexical review."},
    {"id":"performance-standards","heading":"Performance Standards","scope":"all_normative_items","status":"partial","mechanism":"instruction","rule_ids":["performance-review"],"supported_languages":["all"],"enforcement_stages":["prompt"],"limitations":"Performance claims require measured evidence; hotspot checks are not automated.","notes":"Performance signals request baseline/remeasurement and review of common hotspot patterns."},
    {"id":"security-standards","heading":"Security Standards","scope":"all_normative_items","status":"partial","mechanism":"review","rule_ids":["no-committed-secrets","sql-parameterization","public-input-validation","safe-construction-review","public-endpoint-review","auth-input-enforcement","endpoint-controls-review"],"supported_languages":["all"],"enforcement_stages":["prompt","post_tool","stop"],"limitations":"Secure defaults and authorization remain language/framework work; endpoint and contextual builder findings remain review.","notes":"High-confidence secret, SQL, selected input, string-built boundary, endpoint signals, auth/input control signals, and explicit control guidance exist; authorization remains review."},
    {"id":"dependency-standards","heading":"Dependency Standards","scope":"all_normative_items","status":"partial","mechanism":"review","rule_ids":["new-dependency-review","dependency-change-review"],"supported_languages":["all"],"enforcement_stages":["prompt","stop"],"limitations":"License, maintenance, transitive, and runtime analysis remains review.","notes":"Dependency diffs trigger review and contextual evidence guidance."},
    {"id":"documentation-standards","heading":"Documentation Standards","scope":"all_normative_items","status":"partial","mechanism":"instruction","rule_ids":["documentation-change-review"],"supported_languages":["all"],"enforcement_stages":["prompt"],"limitations":"Documentation drift detection is not automated.","notes":"Setup/config/operations changes activate documentation and rollout guidance."},
    {"id":"review-and-change-standards","heading":"Review And Change Standards","scope":"all_normative_items","status":"partial","mechanism":"evidence","rule_ids":["preserve-unrelated-user-changes","evidence-claims-honest","commit-pr-evidence"],"supported_languages":["all"],"enforcement_stages":["stop","report"],"limitations":"PR metadata generation remains guidance and never pushes or messages externally.","notes":"Scope preservation/evidence honesty are enforced and completion summaries request executed evidence."},
    {"id":"refactoring-standards","heading":"Refactoring Standards","scope":"all_normative_items","status":"partial","mechanism":"native","rule_ids":["justification-metadata","refactor-discipline-review"],"supported_languages":["all"],"enforcement_stages":["prompt","post_tool","stop"],"limitations":"Structural and diff checks are not universal; semantic public-behavior preservation remains review.","notes":"Touched temporary/TODO/disabled markers fail without metadata; refactor signals request disciplined scope and tests."},
    {"id":"debugging-protocol","heading":"Debugging Protocol","scope":"all_normative_items","status":"partial","mechanism":"instruction","rule_ids":["debugging-protocol"],"supported_languages":["all"],"enforcement_stages":["packet","stop"],"limitations":"Evidence is requested but semantic hypothesis and reproduction quality are not proven.","notes":"Bug-fix intent activates a protocol packet requiring reproduction, hypothesis, root-cause repair, regression evidence, and diagnostic cleanup."},
    {"id":"anti-slop-checklist","heading":"Anti-Slop Checklist","scope":"all_normative_items","status":"partial","mechanism":"native","rule_ids":["anti-slop-checklist"],"supported_languages":["all"],"enforcement_stages":["post_tool","stop"],"limitations":"Diff checks cover debug/scaffolding/suppression signals only; architectural slop remains review.","notes":"High-confidence lexical anti-slop signals are surfaced as warning-tier diff review."},
    {"id":"rust","heading":"Rust","scope":"all_normative_items","status":"partial","mechanism":"native","rule_ids":["rust-no-unsafe","rust-no-unwrap-expect","rust-spawn-cancellation","rust-no-mutable-global","rust-async-timeout-review","rust-id-unit-newtype-review"],"supported_languages":["rust"],"enforcement_stages":["packet","post_tool","stop"],"limitations":"Native checks are lexical; async timeout and newtype rules are review guidance, not semantic proof.","notes":"Native checks cover unsafe, unwrap/expect, common spawn, and mutable-global patterns; timeout and newtype guidance is explicit review."},